1,The firm counts Rolls Royce  BMW  Onkyo  Pioneer  Kilpsch  and ASUS amongst its client base  and has stuck deals with semiconductor and middleware companies including NXP  Analog Devices (ADI)  and CRI Middleware to have Dirac audio directly integrated into chipsets and platforms.
1,Beginning a new era in its global quest to enable superior sound experiences across all content and devices  Swedish sound pioneer Dirac has announced the completion of a direct share equity issue that raised $17.73-million USD (150 MSEK) from new investor TIN Fonder and current investor DIG Investment.
1,The resulting technology was 2 years in the making  he says  with an MVP in April 2010 and Ohpen’s first live client signed in 2012 “[It] took a couple of years to actually program the engine.
1,Sabre Airline Solutions said using Adyen boosted conversion rates in Mexico 8%.
1,ParkBee optimises occupancy rates in parking locations through data and smart technology for reservations  dynamic pricing and direct integration in large parking and mobility platforms of  amongst others  Parkmobile  Yellowbrick and ANWB.
1,Salesmanago offers all-in-one  next-generation marketing automation software used by teams in more than 10 000 companies of all sizes.
1,French startup ManoMano is raising another mega round of funding.
1,All have made follow-on investments in DigiExam’s Series A financing.
1,It has also developed new sales channels  working directly with semiconductor and middleware companies — like NXP  Analog Devices (ADI)  and CRI Middleware — to integrate Dirac audio directly into chipsets and platforms.
1,Adyen’s aggressive year of client and technology additions has been capped off by adding McDonald’s to its network  bringing in a merchant with a huge appetite for streamlined app-driven transactions.
1,To that end  the list of private property companies ParkBee is already working with include JLL  BT and local councils in the U.K.
1,In 2011  Robeco  with Boeren as its COO  became Ohpen’s first client.
1,Zenaton is already working with a big client and handles millions of workflow instances for them.
1,Dirac’s digital audio solutions are used by brands such as Bentley  Rolls Royce  BMW  Volvo  Huawei  OPPO  Xiaomi  Motorola  Harman  Klipsch  RHA  and more.
1,The project partners are now working together with monopile producers EEW Special Pipe Constructions  the Sif Group  and the welding consumables and power source manufacturer Lincoln Electric to further optimize the steel of the heavy plate for the welding processes used in constructing offshore wind turbines.
1,Faith plays an important role in Savannah Guthrie's life  and over the years  the TODAY co-anchor developed a list of some Bible verses that really speak to her.
0,Further details about Jscrambler’s behavior-based Magecart mitigation technology can be found in this info sheet .
0,According to the press release  there will be a MapMyIndia banner inside the Truecaller app  which will contain information about COVID-19-related healthcare facilities.
0,The new Shippeo mobile application features include:
0,OZ Architecture is excited to see the multi-family  mixed-use project come to life.
0,Fastned CEO Michel Langsall says that “hundreds of these sites” are still in demand in the UK and that the company wants to enter and remain in talks with landowners and partners.
0,Last month  he was allowed to hand over a bunch of flowers to an employee who has been with Xeltis for 5 years.
0,Helpling  a platform for cleaners  and courier service Stuart both scored one out of 10  followed by cab service Uber  food delivery spinoff Uber Eats and odd-jobs app TaskRabbit  each with two points.
0,This article was provided by JScrambler.
0,It was particularly bad timing for Blacklane  considering that in the lead up to the pandemic  it looked to be on course to turn a profit on its focused model.
0,The Seedrs page for Etergo is still live and indicates that the scooter was supposed to go into production by Q2 2018.
0,Shippeo has built a leading  real-time visibility solution in Europe  serving a market that is one of the fastest-growing sub-sectors of the supply-chain software market.
0,Truecaller India MD Rishit Jhunjhunwala said the company is committed to extending help to those who are on the frontlines and to communities.
0,We are convinced she will effectively lead our team in London and realise our intended expansion in the UK together with the great team that has already proven ParkBee is in an excellent position to create substantial value for real estate owners and consumers.
0,In the first fixture of the day (June 9) at Kiel T10 league  PSV Hann Munden will square off against VFB Fallersleben.
0,For example  JavaScript Protection company  JScrambler offers:
0,But that business nearly evaporated when the coronavirus halted air travel  and Blacklane was forced to pivot:
